{
  "repo": {
    "name": "microsoft/vscode",
    "url": "https://github.com/microsoft/vscode",
    "totalCommits": 4820,
    "dateRange": {
      "start": "2015-04-01",
      "end": "2026-07-01"
    },
    "contributors": 1240
  },
  "generation": {
    "model": "codex (gpt-5.x)",
    "generatedAt": "2026-07-28T10:00:00Z",
    "estTokens": 41200,
    "estCostUsd": 0.31
  },
  "acts": [
    {
      "id": "act-1",
      "order": 1,
      "codename": "Architecture Phase 1",
      "dateRange": {
        "start": "2015-01-01",
        "end": "2015-06-01"
      },
      "commitCount": 1160,
      "narration": [
        {
          "text": "Act 1: Massive architectural refactoring.",
          "revealed": true
        },
        {
          "text": "The initial architecture introduces the core text-model and tree-view abstractions.",
          "revealed": true
        },
        {
          "text": "A substantial amount of boilerplate was created to set up the extension host communication layer via IPC.",
          "revealed": true
        }
      ],
      "keyCommits": [],
      "connections": [
        {
          "from": "tree-view",
          "to": "monaco_16",
          "kind": "implements"
        },
        {
          "from": "ipc",
          "to": "debug-adapter_23",
          "kind": "listens"
        },
        {
          "from": "tree-view_20",
          "to": "debug-adapter_23",
          "kind": "extends"
        },
        {
          "from": "git-provider",
          "to": "tree-view_20",
          "kind": "decorates"
        },
        {
          "from": "tree-view_20",
          "to": "terminal_22",
          "kind": "decorates"
        },
        {
          "from": "tree-view",
          "to": "text-model_19",
          "kind": "decorates"
        },
        {
          "from": "ipc_18",
          "to": "terminal_22",
          "kind": "extends"
        },
        {
          "from": "terminal",
          "to": "ipc_18",
          "kind": "decorates"
        },
        {
          "from": "text-model_19",
          "to": "search_24",
          "kind": "listens"
        },
        {
          "from": "extension-host",
          "to": "debug-adapter_23",
          "kind": "depends"
        },
        {
          "from": "extension-host",
          "to": "settings",
          "kind": "imports"
        },
        {
          "from": "debug-adapter_23",
          "to": "search_24",
          "kind": "imports"
        },
        {
          "from": "debug-adapter",
          "to": "search_24",
          "kind": "decorates"
        },
        {
          "from": "text-model",
          "to": "search",
          "kind": "instantiates"
        },
        {
          "from": "shell_15",
          "to": "terminal_22",
          "kind": "listens"
        },
        {
          "from": "keybinding",
          "to": "extension-host_17",
          "kind": "depends"
        },
        {
          "from": "settings",
          "to": "text-model_19",
          "kind": "decorates"
        },
        {
          "from": "tree-view",
          "to": "keybinding_21",
          "kind": "extends"
        },
        {
          "from": "shell_15",
          "to": "tree-view_20",
          "kind": "extends"
        },
        {
          "from": "terminal_22",
          "to": "search_24",
          "kind": "instantiates"
        },
        {
          "from": "keybinding_21",
          "to": "debug-adapter_23",
          "kind": "depends"
        },
        {
          "from": "tree-view_20",
          "to": "keybinding_21",
          "kind": "imports"
        },
        {
          "from": "keybinding",
          "to": "copilot",
          "kind": "imports"
        },
        {
          "from": "terminal",
          "to": "search",
          "kind": "depends"
        },
        {
          "from": "terminal_22",
          "to": "debug-adapter_23",
          "kind": "implements"
        },
        {
          "from": "ipc",
          "to": "keybinding",
          "kind": "instantiates"
        },
        {
          "from": "text-model_19",
          "to": "debug-adapter_23",
          "kind": "listens"
        },
        {
          "from": "terminal",
          "to": "terminal_22",
          "kind": "extends"
        },
        {
          "from": "monaco_16",
          "to": "terminal_22",
          "kind": "extends"
        },
        {
          "from": "notebooks",
          "to": "search_24",
          "kind": "implements"
        },
        {
          "from": "copilot",
          "to": "extension-host_17",
          "kind": "instantiates"
        },
        {
          "from": "notebooks",
          "to": "extensions-viewlet",
          "kind": "implements"
        },
        {
          "from": "debug-adapter",
          "to": "extensions-viewlet",
          "kind": "imports"
        },
        {
          "from": "debug-adapter",
          "to": "tree-view_20",
          "kind": "decorates"
        },
        {
          "from": "copilot",
          "to": "terminal_22",
          "kind": "instantiates"
        },
        {
          "from": "notebooks",
          "to": "shell_15",
          "kind": "extends"
        },
        {
          "from": "shell_15",
          "to": "extension-host_17",
          "kind": "listens"
        },
        {
          "from": "monaco_16",
          "to": "keybinding_21",
          "kind": "depends"
        },
        {
          "from": "text-model",
          "to": "extension-host_17",
          "kind": "instantiates"
        },
        {
          "from": "debug-adapter",
          "to": "git-provider",
          "kind": "imports"
        },
        {
          "from": "search",
          "to": "monaco_16",
          "kind": "decorates"
        },
        {
          "from": "ipc",
          "to": "search",
          "kind": "depends"
        },
        {
          "from": "settings",
          "to": "extensions-viewlet",
          "kind": "listens"
        }
      ],
      "modules": [
        {
          "name": "shell",
          "path": "src/vs/workbench/shell.ts",
          "status": "unchanged",
          "linesChanged": 62,
          "summary": "Core module handling shell functionality in act 1"
        },
        {
          "name": "monaco",
          "path": "src/vs/editor",
          "status": "modified",
          "linesChanged": 330,
          "summary": "Core module handling monaco functionality in act 1"
        },
        {
          "name": "extension-host",
          "path": "src/vs/workbench/services/extensions/node/extensionHostMain.ts",
          "status": "deleted",
          "linesChanged": 893,
          "summary": "Core module handling extension-host functionality in act 1"
        },
        {
          "name": "ipc",
          "path": "src/vs/base/parts/ipc",
          "status": "modified",
          "linesChanged": 161,
          "summary": "Core module handling ipc functionality in act 1"
        },
        {
          "name": "text-model",
          "path": "src/vs/editor/common/model/textModel.ts",
          "status": "deleted",
          "linesChanged": 290,
          "summary": "Core module handling text-model functionality in act 1"
        },
        {
          "name": "tree-view",
          "path": "src/vs/base/browser/ui/tree/tree.ts",
          "status": "modified",
          "linesChanged": 103,
          "summary": "Core module handling tree-view functionality in act 1"
        },
        {
          "name": "keybinding",
          "path": "src/vs/platform/keybinding/common/keybinding.ts",
          "status": "unchanged",
          "linesChanged": 880,
          "summary": "Core module handling keybinding functionality in act 1"
        },
        {
          "name": "terminal",
          "path": "src/vs/workbench/contrib/terminal/browser/terminal.ts",
          "status": "modified",
          "linesChanged": 218,
          "summary": "Core module handling terminal functionality in act 1"
        },
        {
          "name": "debug-adapter",
          "path": "src/vs/workbench/contrib/debug/node/debugAdapter.ts",
          "status": "modified",
          "linesChanged": 719,
          "summary": "Core module handling debug-adapter functionality in act 1"
        },
        {
          "name": "search",
          "path": "src/vs/workbench/services/search/common/searchService.ts",
          "status": "modified",
          "linesChanged": 510,
          "summary": "Core module handling search functionality in act 1"
        },
        {
          "name": "notebooks",
          "path": "src/vs/workbench/contrib/notebook/browser/notebook.ts",
          "status": "unchanged",
          "linesChanged": 211,
          "summary": "Core module handling notebooks functionality in act 1"
        },
        {
          "name": "copilot",
          "path": "src/vs/workbench/contrib/inlineChat/browser/inlineChat.ts",
          "status": "new",
          "linesChanged": 174,
          "summary": "Core module handling copilot functionality in act 1"
        },
        {
          "name": "settings",
          "path": "src/vs/workbench/services/configuration/common/configuration.ts",
          "status": "new",
          "linesChanged": 785,
          "summary": "Core module handling settings functionality in act 1"
        },
        {
          "name": "extensions-viewlet",
          "path": "src/vs/workbench/contrib/extensions/browser/extensionsViewlet.ts",
          "status": "modified",
          "linesChanged": 256,
          "summary": "Core module handling extensions-viewlet functionality in act 1"
        },
        {
          "name": "git-provider",
          "path": "extensions/git/src/repository.ts",
          "status": "unchanged",
          "linesChanged": 622,
          "summary": "Core module handling git-provider functionality in act 1"
        },
        {
          "name": "shell_15",